[
  {
    "id": "llama-3.1-8b",
    "aliases": ["llama3.1-8b", "llama-3.1-8b-instruct"],
    "displayName": "Llama 3.1 8B",
    "family": "llama",
    "parameterCount": 8030000000,
    "layers": 32,
    "kvHeads": 8,
    "headDim": 128,
    "declaredMaxContextTokens": 131072,
    "sourceIds": ["meta-llama-3.1"],
    "reviewedAt": "2026-06-01"
  },
  {
    "id": "llama-3.1-70b",
    "aliases": ["llama3.1-70b", "llama-3.1-70b-instruct"],
    "displayName": "Llama 3.1 70B",
    "family": "llama",
    "parameterCount": 70500000000,
    "layers": 80,
    "kvHeads": 8,
    "headDim": 128,
    "declaredMaxContextTokens": 131072,
    "sourceIds": ["meta-llama-3.1"],
    "reviewedAt": "2026-06-01"
  },
  {
    "id": "llama-3.1-405b",
    "aliases": ["llama3.1-405b", "llama-3.1-405b-instruct"],
    "displayName": "Llama 3.1 405B",
    "family": "llama",
    "parameterCount": 405000000000,
    "layers": 126,
    "kvHeads": 8,
    "headDim": 128,
    "declaredMaxContextTokens": 131072,
    "sourceIds": ["meta-llama-3.1"],
    "reviewedAt": "2026-06-01"
  },
  {
    "id": "mistral-7b-v0.3",
    "aliases": ["mistral-7b", "mistral-7b-v0.3"],
    "displayName": "Mistral 7B v0.3",
    "family": "mistral",
    "parameterCount": 7240000000,
    "layers": 32,
    "kvHeads": 8,
    "headDim": 128,
    "declaredMaxContextTokens": 32768,
    "sourceIds": ["mistral-ai"],
    "reviewedAt": "2026-06-01"
  },
  {
    "id": "mixtral-8x7b",
    "aliases": ["mixtral-8x7b-instruct", "mixtral"],
    "displayName": "Mixtral 8x7B",
    "family": "mistral",
    "parameterCount": 46900000000,
    "layers": 32,
    "kvHeads": 8,
    "headDim": 128,
    "declaredMaxContextTokens": 32768,
    "sourceIds": ["mistral-ai"],
    "reviewedAt": "2026-06-01"
  }
]
